{
  "block": 0,
  "cost_known": true,
  "cost_usd": 0.000161856,
  "created_at": "2026-10-20T20:14:24Z",
  "finish_reason": "stop",
  "item_id": "f309d4d0aabf03a015bb1125544d916aa6fe520d",
  "judge": "qwen_s",
  "judge_fp": "c0ecf5eb99cea0b5",
  "latency_ms": 1211.149,
  "n": 1,
  "output": "{\"coherence\": [5], \"consistency\": [5], \"fluency\": [5], \"relevance\": [5]}",
  "output_sha256": "7c35105ed57bd80e6ae0a28da5130e13af8b41a0f7e240eb6e308d8a2c5ab12f",
  "output_withheld": false,
  "pass": "primary",
  "prompt_sha256": "a09760938bb66f7db786f1c0afd963b4750b52167677c7bc138832e445b5fbe1",
  "provider": "Alibaba",
  "response_model": "eval-qwen-flash",
  "scores": [
    5.0
  ],
  "set_id": "cnn_dailymail_200-2arms-904523b2f2ea",
  "tokens_in": 1220,
  "tokens_out": 28,
  "truncated": 0.0
}
