{
  "block": 1,
  "cost_known": true,
  "cost_usd": 0.000284376,
  "created_at": "2026-10-20T17:34:25Z",
  "finish_reason": "stop",
  "item_id": "c27cf1b136cc270023de959e7ab24638021bc43f",
  "judge": "qwen_s",
  "judge_fp": "c0ecf5eb99cea0b5",
  "latency_ms": null,
  "n": 14,
  "output": "{\"coherence\": [5, 5, 4, 4, 5, 5, 5, 3, 5, 5, 4, 4, 1, 5], \"consistency\": [5, 5, 5, 5, 5, 5, 5, 5, 5, 5, 5, 5, 1, 5], \"fluency\": [5, 5, 5, 5, 5, 5, 5, 4, 5, 5, 5, 5, 5, 5], \"relevance\": [5, 5, 4, 4, 5, 5, 5, 2, 5, 5, 4, 4, 1, 5]}",
  "output_sha256": "ca6b61a35ed9e87e379521c1276b714df28be456ef033c1be28b92c5f7cd2f8d",
  "output_withheld": false,
  "pass": "primary",
  "prompt_sha256": "deea5881aa3c1fb128b659f0ba0abb030f4e5a2d36085b56295ec27c4b89d4db",
  "provider": "Alibaba",
  "response_model": "eval-qwen-flash",
  "scores": [
    5.0,
    5.0,
    4.5,
    4.5,
    5.0,
    5.0,
    5.0,
    3.5,
    5.0,
    5.0,
    4.5,
    4.5,
    2.0,
    5.0
  ],
  "set_id": "cnn_dailymail_200-29arms-a079833ca3c9",
  "tokens_in": 1548,
  "tokens_out": 184,
  "truncated": 0.0
}
