{
  "block": 0,
  "cost_known": true,
  "cost_usd": 0.02231,
  "created_at": "2026-10-21T11:17:44Z",
  "finish_reason": "stop",
  "item_id": "9eb7dd37e50b863e99b554ed340e7b766c1b6329",
  "judge": "anthropic_l",
  "judge_fp": "d65edda4f70a628c",
  "latency_ms": 3016.023,
  "n": 15,
  "output": "{\"coherence\": [4, 4, 4, 5, 3, 5, 4, 4, 4, 4, 5, 3, 3, 2, 5], \"consistency\": [3, 5, 5, 5, 5, 5, 3, 5, 5, 4, 5, 3, 4, 2, 5], \"fluency\": [5, 5, 5, 5, 3, 5, 5, 5, 5, 5, 5, 5, 3, 3, 5], \"relevance\": [4, 5, 4, 5, 3, 5, 4, 4, 4, 4, 5, 2, 4, 2, 5]}",
  "output_sha256": "ea34c897bc42c1c5dd9117723d12a3b4a05456070eea76da26ab1bf68df6437d",
  "output_withheld": false,
  "pass": "primary",
  "prompt_sha256": "c598201280ca0e70720ff8aa24da0b8392e78d61ad1808208b79c18c72355043",
  "provider": "Claude Platform on AWS",
  "response_model": "eval-opus-5",
  "scores": [
    4.0,
    4.75,
    4.5,
    5.0,
    3.5,
    5.0,
    4.0,
    4.5,
    4.5,
    4.25,
    5.0,
    3.25,
    3.5,
    2.25,
    5.0
  ],
  "set_id": "cnn_dailymail_200-29arms-a079833ca3c9",
  "tokens_in": 3442,
  "tokens_out": 204,
  "truncated": 0.0
}
