{
  "block": 0,
  "cost_known": true,
  "cost_usd": 0.00030304,
  "created_at": "2026-10-20T17:55:25Z",
  "finish_reason": "stop",
  "item_id": "4bd20bce9066eb3e0950299a340faa935026fe5a",
  "judge": "gemma_l",
  "judge_fp": "5031d8671837eb80",
  "latency_ms": null,
  "n": 15,
  "output": "```json\n{\"coherence\": [5, 5, 5, 5, 5, 5, 5, 5, 2, 5, 5, 5, 4, 5, 5], \"consistency\": [4, 5, 5, 5, 5, 5, 5, 5, 5, 5, 5, 5, 5, 5, 5], \"fluency\": [5, 5, 5, 5, 5, 5, 5, 5, 5, 5, 5, 5, 4, 5, 5], \"relevance\": [5, 5, 5, 4, 5, 5, 5, 5, 1, 5, 5, 5, 3, 5, 5]}\n```",
  "output_sha256": "90aae7d209a952b1a16c8a9c8f9e98ed2b962188edbff248c0094622f0d700d4",
  "output_withheld": false,
  "pass": "noise",
  "prompt_sha256": "3c88da82686c3bd2e3d9622696e7f13f43cc7b58f4ddc2b753e5a8a3d8547db6",
  "provider": "CoreWeave",
  "response_model": "eval-gemma-31b",
  "scores": [
    4.75,
    5.0,
    5.0,
    4.75,
    5.0,
    5.0,
    5.0,
    5.0,
    3.25,
    5.0,
    5.0,
    5.0,
    4.0,
    5.0,
    5.0
  ],
  "set_id": "cnn_dailymail_200-29arms-a079833ca3c9",
  "tokens_in": 2347,
  "tokens_out": 201,
  "truncated": 0.0
}
