{
  "block": 0,
  "cost_known": true,
  "cost_usd": 0.019095,
  "created_at": "2026-10-21T12:15:15Z",
  "finish_reason": "stop",
  "item_id": "cd745b3c66da579d0538e668fde2922c0b3bc9f5",
  "judge": "anthropic_l",
  "judge_fp": "d65edda4f70a628c",
  "latency_ms": 3328.507,
  "n": 15,
  "output": "{\"coherence\": [5, 5, 4, 5, 4, 2, 5, 4, 4, 4, 4, 4, 5, 5, 4], \"consistency\": [5, 5, 5, 4, 5, 5, 5, 5, 5, 5, 5, 5, 5, 5, 5], \"fluency\": [5, 5, 5, 5, 5, 5, 5, 4, 4, 5, 4, 5, 5, 5, 5], \"relevance\": [5, 5, 4, 5, 5, 2, 5, 4, 4, 4, 4, 4, 5, 5, 3]}",
  "output_sha256": "b6e7855d7508706a9923f1d04b6b8d14174f0042984f24a6a90fb212e7f27785",
  "output_withheld": false,
  "pass": "primary",
  "prompt_sha256": "396eb050638e3fb60f03a07d7cc0954de44c591264ccf0912897a95e0343abf2",
  "provider": "Claude Platform on AWS",
  "response_model": "eval-opus-5",
  "scores": [
    5.0,
    5.0,
    4.5,
    4.75,
    4.75,
    3.5,
    5.0,
    4.25,
    4.25,
    4.5,
    4.25,
    4.5,
    5.0,
    5.0,
    4.25
  ],
  "set_id": "cnn_dailymail_200-29arms-a079833ca3c9",
  "tokens_in": 2799,
  "tokens_out": 204,
  "truncated": 0.0
}
