{
  "block": 0,
  "cost_known": true,
  "cost_usd": 0.024595,
  "created_at": "2026-10-21T10:56:17Z",
  "finish_reason": "stop",
  "item_id": "0f39feebc34fee03b8c647d1557eb40bb20f4e8b",
  "judge": "anthropic_l",
  "judge_fp": "d65edda4f70a628c",
  "latency_ms": 3140.497,
  "n": 15,
  "output": "{\"coherence\": [5, 4, 5, 3, 4, 2, 5, 5, 4, 4, 2, 4, 5, 4, 5], \"consistency\": [5, 5, 5, 5, 3, 4, 5, 5, 4, 5, 5, 5, 5, 3, 5], \"fluency\": [5, 4, 5, 3, 3, 2, 5, 5, 5, 4, 1, 5, 5, 5, 5], \"relevance\": [5, 5, 5, 4, 4, 2, 5, 5, 4, 4, 2, 4, 5, 4, 5]}",
  "output_sha256": "9a99d0466ec759982eb113d87a619504088252721d234ea0e24ef58db9f5754e",
  "output_withheld": false,
  "pass": "primary",
  "prompt_sha256": "b9b6587016d0d6f11487e648dd53bdcdfabf058610ca4282425644695fb80281",
  "provider": "Claude Platform on AWS",
  "response_model": "eval-opus-5",
  "scores": [
    5.0,
    4.5,
    5.0,
    3.75,
    3.5,
    2.5,
    5.0,
    5.0,
    4.25,
    4.25,
    2.5,
    4.5,
    5.0,
    4.0,
    5.0
  ],
  "set_id": "cnn_dailymail_200-29arms-a079833ca3c9",
  "tokens_in": 3899,
  "tokens_out": 204,
  "truncated": 0.0
}
