{
  "block": 0,
  "cost_known": true,
  "cost_usd": 0.0077135,
  "created_at": "2026-10-21T11:04:24Z",
  "finish_reason": "stop",
  "item_id": "41592d02ca324abe370ff063962b97ca5d976e73",
  "judge": "openai_l",
  "judge_fp": "023fc9970ad55550",
  "latency_ms": 2772.623,
  "n": 15,
  "output": "{\"coherence\":[5,5,1,4,5,5,5,5,5,5,5,5,4,5,5],\"consistency\":[5,5,5,1,4,4,5,5,5,4,5,4,3,5,5],\"fluency\":[5,5,2,5,5,5,5,5,5,5,5,5,5,5,5],\"relevance\":[5,5,2,1,5,5,5,5,5,4,5,5,4,5,5]}",
  "output_sha256": "5c752511dc5ac55681e25bfdd0db36bc2351c724e9e3c645677bd5ea53909e5c",
  "output_withheld": false,
  "pass": "primary",
  "prompt_sha256": "c3f2c5f1a3e1056ea5faa56068a2dfa9e697a19d09d485bcead0403b25890892",
  "provider": "OpenAI",
  "response_model": "eval-gpt-6sol",
  "scores": [
    5.0,
    5.0,
    2.5,
    2.75,
    4.75,
    4.75,
    5.0,
    5.0,
    5.0,
    4.5,
    5.0,
    4.75,
    4.0,
    5.0,
    5.0
  ],
  "set_id": "cnn_dailymail_200-29arms-a079833ca3c9",
  "tokens_in": 2538,
  "tokens_out": 137,
  "truncated": 0.0
}
