{
  "block": 0,
  "cost_known": true,
  "cost_usd": 8.61e-05,
  "created_at": "2026-10-20T20:12:11Z",
  "finish_reason": "stop",
  "item_id": "dd4f726200355d742f631777aaa7b265533c0baf",
  "judge": "gemma_l",
  "judge_fp": "5031d8671837eb80",
  "latency_ms": 1535.565,
  "n": 1,
  "output": "```json\n{\"coherence\": [5], \"consistency\": [4], \"fluency\": [5], \"relevance\": [3]}\n```",
  "output_sha256": "b745fd8a16ee497b85178c5969c426260db639b963f36c91d9278394d90267fe",
  "output_withheld": false,
  "pass": "primary",
  "prompt_sha256": "1de5fb19f618a8dbc061ec22f51dbbfe649e28eaeeb11e16ed58d297e8826e86",
  "provider": "Parasail",
  "response_model": "eval-gemma-31b",
  "scores": [
    4.25
  ],
  "set_id": "cnn_dailymail_200-2arms-904523b2f2ea",
  "tokens_in": 636,
  "tokens_out": 33,
  "truncated": 0.0
}
