{
  "block": 1,
  "cost_known": true,
  "cost_usd": 0.000346646,
  "created_at": "2026-10-20T17:07:02Z",
  "finish_reason": "stop",
  "item_id": "934a2d9235022c9e8a6aeec5e7e941b127569b76",
  "judge": "qwen_s",
  "judge_fp": "c0ecf5eb99cea0b5",
  "latency_ms": null,
  "n": 14,
  "output": "```json\n{\n  \"coherence\": [5, 5, 5, 5, 4, 2, 3, 5, 4, 5, 5, 5, 5, 5],\n  \"consistency\": [5, 5, 5, 5, 5, 5, 5, 5, 5, 5, 5, 5, 5, 5],\n  \"fluency\": [5, 5, 5, 5, 5, 4, 3, 5, 5, 5, 5, 5, 5, 5],\n  \"relevance\": [5, 5, 5, 5, 4, 2, 3, 5, 3, 5, 5, 5, 5, 5]\n}\n```",
  "output_sha256": "0ee2421f71497602383ce0348cad21f39c27ba5742eada2146fa48dfda41ebcf",
  "output_withheld": false,
  "pass": "primary",
  "prompt_sha256": "7659b875430387cf18b7211c16512b6868ee692959ad6c0c3c3038e6dcc727c4",
  "provider": "Alibaba",
  "response_model": "eval-qwen-flash",
  "scores": [
    5.0,
    5.0,
    5.0,
    5.0,
    4.5,
    3.25,
    3.5,
    5.0,
    4.25,
    5.0,
    5.0,
    5.0,
    5.0,
    5.0
  ],
  "set_id": "cnn_dailymail_200-29arms-a079833ca3c9",
  "tokens_in": 1913,
  "tokens_out": 200,
  "truncated": 0.0
}
