{
  "block": 1,
  "cost_known": true,
  "cost_usd": 0.015605,
  "created_at": "2026-10-21T12:14:57Z",
  "finish_reason": "stop",
  "item_id": "cb56840e21bbf8a71cd0337b5908d3f783862ae0",
  "judge": "anthropic_l",
  "judge_fp": "d65edda4f70a628c",
  "latency_ms": 2898.803,
  "n": 14,
  "output": "{\"coherence\": [4, 5, 3, 4, 4, 4, 5, 4, 5, 4, 5, 5, 4, 5], \"consistency\": [5, 5, 5, 5, 5, 5, 4, 5, 5, 4, 5, 5, 5, 5], \"fluency\": [5, 5, 3, 4, 5, 5, 5, 4, 5, 4, 5, 5, 4, 5], \"relevance\": [4, 5, 3, 4, 3, 4, 5, 4, 5, 4, 5, 5, 4, 5]}",
  "output_sha256": "4713bfe1340d82833ec53d5ab3a6cb08226c0818954a88ec212b18481fa63ec0",
  "output_withheld": false,
  "pass": "primary",
  "prompt_sha256": "9729d965bd1308af1226221ee0155e1dfd87bfddac647564cfb800de9b8b35e0",
  "provider": "Claude Platform on AWS",
  "response_model": "eval-opus-5",
  "scores": [
    4.5,
    5.0,
    3.5,
    4.25,
    4.25,
    4.5,
    4.75,
    4.25,
    5.0,
    4.0,
    5.0,
    5.0,
    4.25,
    5.0
  ],
  "set_id": "cnn_dailymail_200-29arms-a079833ca3c9",
  "tokens_in": 2161,
  "tokens_out": 192,
  "truncated": 0.0
}
