{
  "block": 0,
  "cost_known": true,
  "cost_usd": 0.00024744,
  "created_at": "2026-10-20T17:39:51Z",
  "finish_reason": "stop",
  "item_id": "e2bccd4dec93c9bb7b327827dae004c2d494ec31",
  "judge": "gemma_l",
  "judge_fp": "5031d8671837eb80",
  "latency_ms": null,
  "n": 15,
  "output": "```json\n{\"coherence\": [5, 5, 5, 4, 5, 5, 5, 5, 5, 5, 5, 4, 5, 5, 5], \"consistency\": [5, 5, 5, 3, 5, 3, 5, 5, 5, 5, 5, 5, 5, 5, 5], \"fluency\": [5, 5, 5, 5, 5, 5, 5, 5, 5, 5, 5, 5, 5, 5, 5], \"relevance\": [5, 5, 5, 4, 5, 2, 5, 5, 5, 5, 5, 4, 5, 5, 5]}\n```",
  "output_sha256": "cc529aa3477d310dd6c9d40bf4fd373fe15e8b7cb3086fc837b1dae2291cb617",
  "output_withheld": false,
  "pass": "primary",
  "prompt_sha256": "a050d16d37e2c055753f94919f44aad0388beb29bc90fd2bc17da9fc6e9d5bac",
  "provider": "CoreWeave",
  "response_model": "eval-gemma-31b",
  "scores": [
    5.0,
    5.0,
    5.0,
    4.0,
    5.0,
    3.75,
    5.0,
    5.0,
    5.0,
    5.0,
    5.0,
    4.5,
    5.0,
    5.0,
    5.0
  ],
  "set_id": "cnn_dailymail_200-29arms-a079833ca3c9",
  "tokens_in": 1791,
  "tokens_out": 201,
  "truncated": 0.0
}
