{
  "block": 0,
  "cost_known": true,
  "cost_usd": 0.0001476,
  "created_at": "2026-10-20T20:17:43Z",
  "finish_reason": "stop",
  "item_id": "afd04a7bf645f376ba6d6ba5880a4725431793c1",
  "judge": "gemma_l",
  "judge_fp": "5031d8671837eb80",
  "latency_ms": 2034.566,
  "n": 1,
  "output": "```json\n{\"coherence\": [5], \"consistency\": [5], \"fluency\": [5], \"relevance\": [4]}\n```",
  "output_sha256": "7c4550e07860a6fc3dc3df6c62b7ca9e2ef3fb3b3889c0330e19a6266ee8bf7e",
  "output_withheld": false,
  "pass": "noise",
  "prompt_sha256": "ed15dde05ce037483a89ceadac78a42ee9ce828e9e2e65f1645e63733dd89f52",
  "provider": "Parasail",
  "response_model": "eval-gemma-31b",
  "scores": [
    4.75
  ],
  "set_id": "cnn_dailymail_200-2arms-904523b2f2ea",
  "tokens_in": 899,
  "tokens_out": 33,
  "truncated": 0.0
}
