{
  "block": 0,
  "cost_known": true,
  "cost_usd": 0.017815,
  "created_at": "2026-10-21T11:02:53Z",
  "finish_reason": "stop",
  "item_id": "37477ed1fc065f438021ee3b6d3e2b827e270353",
  "judge": "anthropic_l",
  "judge_fp": "d65edda4f70a628c",
  "latency_ms": 3660.384,
  "n": 15,
  "output": "{\"coherence\": [3, 5, 5, 5, 4, 4, 4, 5, 3, 4, 5, 3, 5, 4, 4], \"consistency\": [5, 5, 5, 5, 5, 5, 5, 5, 4, 5, 3, 5, 5, 5, 5], \"fluency\": [3, 5, 5, 5, 5, 5, 5, 5, 5, 5, 5, 4, 5, 5, 5], \"relevance\": [3, 5, 4, 4, 4, 5, 4, 5, 2, 4, 5, 3, 4, 4, 4]}",
  "output_sha256": "bcbabba6098f5f6e19fd96ceafe74eaf5ffbb4d7595fa77ee563de9256b61993",
  "output_withheld": false,
  "pass": "primary",
  "prompt_sha256": "37abe83d6da8a5b92ecd146bef425a1907736e64341764c5b42962360cbe3690",
  "provider": "Claude Platform on AWS",
  "response_model": "eval-opus-5",
  "scores": [
    3.5,
    5.0,
    4.75,
    4.75,
    4.5,
    4.75,
    4.5,
    5.0,
    3.5,
    4.5,
    4.5,
    3.75,
    4.75,
    4.5,
    4.5
  ],
  "set_id": "cnn_dailymail_200-29arms-a079833ca3c9",
  "tokens_in": 2543,
  "tokens_out": 204,
  "truncated": 0.0
}
