{
  "block": 1,
  "cost_known": true,
  "cost_usd": 5.6648e-05,
  "created_at": "2026-10-20T19:47:55Z",
  "finish_reason": "stop",
  "item_id": "8ba20bec4358b39f84a8a07264f71566bb3c5e8e",
  "judge": "qwen_s",
  "judge_fp": "c0ecf5eb99cea0b5",
  "latency_ms": 1088.961,
  "n": 1,
  "output": "{\"coherence\": [4], \"consistency\": [5], \"fluency\": [5], \"relevance\": [3]}",
  "output_sha256": "7809ece17f318d4c2eac8b64b640c5a8986c26a5aad6fc3e0725417702a24139",
  "output_withheld": false,
  "pass": "primary",
  "prompt_sha256": "ae670bf397321ea11c1b2c9fdeb39dc29396d2ba765d0d3b1f4816438cc05ecd",
  "provider": "Alibaba",
  "response_model": "eval-qwen-flash",
  "scores": [
    4.25
  ],
  "set_id": "cnn_dailymail_200-2arms-904523b2f2ea",
  "tokens_in": 976,
  "tokens_out": 28,
  "truncated": 0.0
}
