{
  "block": 0,
  "cost_known": true,
  "cost_usd": 0.000288136,
  "created_at": "2026-10-20T17:36:35Z",
  "finish_reason": "stop",
  "item_id": "cb56840e21bbf8a71cd0337b5908d3f783862ae0",
  "judge": "qwen_s",
  "judge_fp": "c0ecf5eb99cea0b5",
  "latency_ms": null,
  "n": 15,
  "output": "{\n  \"coherence\": [5, 5, 5, 4, 5, 3, 5, 5, 5, 5, 2, 5, 2, 5, 5],\n  \"consistency\": [5, 5, 5, 5, 5, 5, 5, 5, 5, 5, 5, 5, 5, 5, 5],\n  \"fluency\": [5, 5, 5, 5, 5, 5, 5, 5, 5, 5, 4, 5, 3, 5, 5],\n  \"relevance\": [5, 5, 5, 4, 5, 2, 4, 5, 5, 4, 1, 5, 2, 5, 5]\n}",
  "output_sha256": "3f82836442525e26159f739d736ef958b7f842149e5d105884c355c20d9b0f06",
  "output_withheld": false,
  "pass": "primary",
  "prompt_sha256": "14f9181e94b8a05f84fc9d547c3eaa093e880b449f8ab5eba1a6b914a8d2cc17",
  "provider": "Alibaba",
  "response_model": "eval-qwen-flash",
  "scores": [
    5.0,
    5.0,
    5.0,
    4.5,
    5.0,
    3.75,
    4.75,
    5.0,
    5.0,
    4.75,
    3.0,
    5.0,
    3.0,
    5.0,
    5.0
  ],
  "set_id": "cnn_dailymail_200-29arms-a079833ca3c9",
  "tokens_in": 1501,
  "tokens_out": 207,
  "truncated": 0.0
}
