{
  "block": 0,
  "cost_known": true,
  "cost_usd": 0.0071935,
  "created_at": "2026-10-21T12:17:14Z",
  "finish_reason": "stop",
  "item_id": "e21f3aefeb41b20bc197297ad55d2e2a8933fc45",
  "judge": "openai_l",
  "judge_fp": "023fc9970ad55550",
  "latency_ms": 2562.293,
  "n": 15,
  "output": "{\"coherence\":[5,5,5,5,5,5,5,5,4,5,5,2,5,5,3],\"consistency\":[5,5,4,5,5,5,5,5,4,5,5,1,5,5,1],\"fluency\":[5,5,5,5,5,4,5,5,5,5,5,5,5,5,3],\"relevance\":[4,5,4,5,5,5,5,4,3,5,5,1,5,5,3]}",
  "output_sha256": "72584024c1d5eca9fec84dca01d43ab8b9b607eba38cf54b16b0a8f3ee64ada8",
  "output_withheld": false,
  "pass": "primary",
  "prompt_sha256": "44ecb8fff994bac593355d4a1b8b946ed21fedf56b274266bd725e7bb5a5456d",
  "provider": "OpenAI",
  "response_model": "eval-gpt-6sol",
  "scores": [
    4.75,
    5.0,
    4.5,
    5.0,
    5.0,
    4.75,
    5.0,
    4.75,
    4.0,
    5.0,
    5.0,
    2.25,
    5.0,
    5.0,
    2.5
  ],
  "set_id": "cnn_dailymail_200-29arms-a079833ca3c9",
  "tokens_in": 2330,
  "tokens_out": 137,
  "truncated": 0.0
}
