{
  "block": 1,
  "cost_known": true,
  "cost_usd": 0.000350296,
  "created_at": "2026-10-20T17:57:07Z",
  "finish_reason": "stop",
  "item_id": "7fb513044e371fa3354fc08eaac50975cf65666a",
  "judge": "qwen_s",
  "judge_fp": "c0ecf5eb99cea0b5",
  "latency_ms": null,
  "n": 14,
  "output": "{\n  \"coherence\": [5, 4, 5, 5, 5, 4, 5, 5, 5, 5, 4, 5, 5, 5],\n  \"consistency\": [5, 5, 5, 3, 5, 5, 5, 5, 5, 5, 4, 5, 5, 5],\n  \"fluency\": [5, 5, 5, 5, 5, 5, 5, 5, 5, 5, 4, 5, 5, 5],\n  \"relevance\": [5, 5, 5, 5, 4, 3, 4, 4, 4, 5, 4, 5, 5, 4]\n}",
  "output_sha256": "2a229110d733120bad0543c7b8245e2539f1038ca3b0f5868d5a6bd83fcfe2d8",
  "output_withheld": false,
  "pass": "noise",
  "prompt_sha256": "dba941eeb3cfd081446865a55b37184f46096581aad044571d7e456918ef8c64",
  "provider": "Alibaba",
  "response_model": "eval-qwen-flash",
  "scores": [
    5.0,
    4.75,
    5.0,
    4.5,
    4.75,
    4.25,
    4.75,
    4.75,
    4.75,
    5.0,
    4.0,
    5.0,
    5.0,
    4.75
  ],
  "set_id": "cnn_dailymail_200-29arms-a079833ca3c9",
  "tokens_in": 1953,
  "tokens_out": 195,
  "truncated": 0.0
}
