{
  "block": 0,
  "cost_known": true,
  "cost_usd": 0.008176,
  "created_at": "2026-10-21T12:22:00Z",
  "finish_reason": "stop",
  "item_id": "f78fb08d7ccc8bf7d4a376d5a885c5ab54026a6f",
  "judge": "openai_l",
  "judge_fp": "023fc9970ad55550",
  "latency_ms": 2304.567,
  "n": 15,
  "output": "{\"coherence\":[5,4,5,3,5,5,5,4,5,4,5,5,4,2,3],\"consistency\":[5,3,5,2,5,5,5,4,5,3,2,5,5,1,5],\"fluency\":[5,5,5,5,5,5,5,5,5,5,5,5,5,2,2],\"relevance\":[5,4,5,3,5,5,5,3,5,3,4,5,4,1,1]}",
  "output_sha256": "ec36ca6ce5ba6237084c54462ada24453dd949659ddb6e1f44afac3b6eff5e34",
  "output_withheld": false,
  "pass": "primary",
  "prompt_sha256": "c67df1d1ba105007cde20f6d74ea5e3320635222cbf75d213e92f74aed4a0be8",
  "provider": "OpenAI",
  "response_model": "eval-gpt-6sol",
  "scores": [
    5.0,
    4.0,
    5.0,
    3.25,
    5.0,
    5.0,
    5.0,
    4.0,
    5.0,
    3.75,
    4.0,
    5.0,
    4.5,
    1.5,
    2.75
  ],
  "set_id": "cnn_dailymail_200-29arms-a079833ca3c9",
  "tokens_in": 2723,
  "tokens_out": 137,
  "truncated": 0.0
}
