{
  "block": 0,
  "cost_known": true,
  "cost_usd": 0.0052735,
  "created_at": "2026-10-21T11:14:59Z",
  "finish_reason": "stop",
  "item_id": "8be49747e364357d7c5d32fca516ec230e5083ed",
  "judge": "openai_l",
  "judge_fp": "023fc9970ad55550",
  "latency_ms": 2431.133,
  "n": 15,
  "output": "{\"coherence\":[5,5,5,5,5,3,5,2,5,4,5,2,4,5,5],\"consistency\":[5,5,4,4,5,5,5,2,5,4,5,5,5,4,4],\"fluency\":[5,5,5,5,5,2,5,2,5,4,5,2,3,5,5],\"relevance\":[5,5,5,5,5,3,5,2,5,4,5,3,4,5,5]}",
  "output_sha256": "7ad3cbdf71fd14ce9b9706de523b90abdf696e9c6614c3d5fef81612c399cecc",
  "output_withheld": false,
  "pass": "primary",
  "prompt_sha256": "41144dcc6baf2bcd3b2d57b3addfc6b9f9d6cca7acfb294bf470d40238e1590d",
  "provider": "OpenAI",
  "response_model": "eval-gpt-6sol",
  "scores": [
    5.0,
    5.0,
    4.75,
    4.75,
    5.0,
    3.25,
    5.0,
    2.0,
    5.0,
    4.0,
    5.0,
    3.0,
    4.0,
    4.75,
    4.75
  ],
  "set_id": "cnn_dailymail_200-29arms-a079833ca3c9",
  "tokens_in": 1562,
  "tokens_out": 137,
  "truncated": 0.0
}
