{
  "block": 0,
  "cost_known": true,
  "cost_usd": 0.000473686,
  "created_at": "2026-10-20T16:51:11Z",
  "finish_reason": "stop",
  "item_id": "574767c29dfee14ea227639f45387c07437a55e5",
  "judge": "qwen_s",
  "judge_fp": "c0ecf5eb99cea0b5",
  "latency_ms": null,
  "n": 15,
  "output": "{\n  \"coherence\": [5, 4, 1, 5, 4, 5, 5, 4, 4, 5, 2, 4, 3, 5, 5],\n  \"consistency\": [5, 4, 2, 5, 4, 5, 5, 4, 5, 5, 3, 3, 2, 5, 5],\n  \"fluency\": [5, 5, 1, 5, 5, 5, 5, 5, 5, 5, 4, 4, 5, 5, 5],\n  \"relevance\": [5, 4, 2, 5, 4, 5, 5, 4, 4, 5, 3, 4, 2, 5, 5]\n}",
  "output_sha256": "b287151d1f50bc300884bf6cf6a80ca50513c4d5240e4acb9fa0ea27d737492b",
  "output_withheld": false,
  "pass": "primary",
  "prompt_sha256": "f23b5b74af6e4fa968d98d09a224aec63c0a69f8a525a1317fabfb3c36f506b7",
  "provider": "Alibaba",
  "response_model": "eval-qwen-flash",
  "scores": [
    5.0,
    4.25,
    1.5,
    5.0,
    4.25,
    5.0,
    5.0,
    4.25,
    4.5,
    5.0,
    3.0,
    3.75,
    3.0,
    5.0,
    5.0
  ],
  "set_id": "cnn_dailymail_200-29arms-a079833ca3c9",
  "tokens_in": 2738,
  "tokens_out": 207,
  "truncated": 0.0
}
