{
  "block": 1,
  "cost_known": true,
  "cost_usd": 0.017085,
  "created_at": "2026-10-21T10:59:56Z",
  "finish_reason": "stop",
  "item_id": "2af3d5505559f8c3d1728dbfac48da66b81af909",
  "judge": "anthropic_l",
  "judge_fp": "d65edda4f70a628c",
  "latency_ms": 3134.429,
  "n": 14,
  "output": "{\"coherence\": [5, 5, 3, 4, 4, 5, 4, 3, 4, 2, 4, 4, 4, 5], \"consistency\": [5, 4, 5, 5, 4, 5, 5, 5, 3, 5, 4, 5, 4, 5], \"fluency\": [5, 5, 4, 5, 5, 5, 5, 5, 5, 2, 4, 5, 5, 5], \"relevance\": [5, 5, 3, 4, 4, 5, 4, 2, 3, 3, 4, 4, 4, 5]}",
  "output_sha256": "6431be14183841dada8017bb74b613584503ae2f7cfce6f7058d807de8834281",
  "output_withheld": false,
  "pass": "primary",
  "prompt_sha256": "52c83df05902988cfeba3a667070fec3af530af2df7eccdf63094de385c34ef4",
  "provider": "Claude Platform on AWS",
  "response_model": "eval-opus-5",
  "scores": [
    5.0,
    4.75,
    3.75,
    4.5,
    4.25,
    5.0,
    4.5,
    3.75,
    3.75,
    3.0,
    4.0,
    4.5,
    4.25,
    5.0
  ],
  "set_id": "cnn_dailymail_200-29arms-a079833ca3c9",
  "tokens_in": 2457,
  "tokens_out": 192,
  "truncated": 0.0
}
