{
  "block": 0,
  "cost_known": true,
  "cost_usd": 0.0076535,
  "created_at": "2026-10-21T11:13:06Z",
  "finish_reason": "stop",
  "item_id": "8012ab9261e117ab47a2759b3c0b628f2a007a82",
  "judge": "openai_l",
  "judge_fp": "023fc9970ad55550",
  "latency_ms": 2779.394,
  "n": 15,
  "output": "{\"coherence\":[5,5,5,5,4,5,5,5,4,3,5,2,2,4,5],\"consistency\":[4,5,4,5,5,5,4,5,3,5,5,1,1,3,2],\"fluency\":[5,5,5,5,5,5,5,4,5,2,5,3,2,5,5],\"relevance\":[5,5,4,5,3,5,5,5,3,2,4,2,1,4,4]}",
  "output_sha256": "9253024e0c39188bdd420b5e16a130cca2064b65897d37b6b5744b22c11936c4",
  "output_withheld": false,
  "pass": "primary",
  "prompt_sha256": "6d4bf2838af8ea3df9ccc21cf58f78b97a47d0728d5cdead4a63b69e2a5b7fc7",
  "provider": "OpenAI",
  "response_model": "eval-gpt-6sol",
  "scores": [
    4.75,
    5.0,
    4.5,
    5.0,
    4.25,
    5.0,
    4.75,
    4.75,
    3.75,
    3.0,
    4.75,
    2.0,
    1.5,
    4.0,
    4.0
  ],
  "set_id": "cnn_dailymail_200-29arms-a079833ca3c9",
  "tokens_in": 2514,
  "tokens_out": 137,
  "truncated": 0.0
}
