{
  "block": 0,
  "cost_known": true,
  "cost_usd": 0.02681,
  "created_at": "2026-10-21T12:09:27Z",
  "finish_reason": "stop",
  "item_id": "a2ee2faeb2dc4e5eab43b1d14233c4ac658f0a8f",
  "judge": "anthropic_l",
  "judge_fp": "d65edda4f70a628c",
  "latency_ms": 3635.706,
  "n": 15,
  "output": "{\"coherence\": [5, 5, 5, 5, 5, 5, 5, 5, 3, 3, 3, 4, 5, 5, 5], \"consistency\": [5, 5, 5, 5, 5, 5, 5, 5, 4, 5, 5, 5, 4, 5, 5], \"fluency\": [5, 5, 5, 5, 5, 5, 5, 5, 3, 5, 3, 5, 5, 5, 5], \"relevance\": [5, 4, 5, 5, 5, 5, 5, 5, 2, 5, 3, 3, 5, 5, 5]}",
  "output_sha256": "bc03cd9cfba1f86107b3263dcd6b20264777b49ec06cc76489bba567596ba379",
  "output_withheld": false,
  "pass": "primary",
  "prompt_sha256": "7bc91b95ae4dc013de52950c6fec0cddad57e5c4916b0ff2df668fb17d95889f",
  "provider": "Claude Platform on AWS",
  "response_model": "eval-opus-5",
  "scores": [
    5.0,
    4.75,
    5.0,
    5.0,
    5.0,
    5.0,
    5.0,
    5.0,
    3.0,
    4.5,
    3.5,
    4.25,
    4.75,
    5.0,
    5.0
  ],
  "set_id": "cnn_dailymail_200-29arms-a079833ca3c9",
  "tokens_in": 4342,
  "tokens_out": 204,
  "truncated": 0.0
}
